{"$schema":"https://json-schema.org/draft/2020-12/schema","title":"Production Manifest V1","type":"object","additionalProperties":false,"required":["manifest_version","created_at","contract_versions","writing_id","revision","body_sha256","page_outputs","qa_status","generator_version"],"properties":{"manifest_version":{"const":"1.0.0"},"created_at":{"type":"string","format":"date-time"},"contract_versions":{"type":"object","additionalProperties":{"type":"string"}},"writing_id":{"type":"string"},"revision":{"type":"integer","minimum":1},"body_sha256":{"type":"string","pattern":"^[a-f0-9]{64}$"},"page_outputs":{"type":"array","items":{"type":"string"}},"qa_status":{"enum":["pass","fail","blocked"]},"generator_version":{"type":"string"}}}
