{
    "manifest_version":  "1.0.0",
    "created_at":  "2026-09-30T00:00:00Z",
    "contract_versions":  {
                              "task_card":  "1.0.0",
                              "keyword_plan":  "1.0.0",
                              "finalization":  "1.0.0",
                              "visual_output":  "1.0.0"
                          },
    "body_sha256":  "ef3ab2cc32b4fc016a1cf929abfd75523a9aeb3703206df7a1568317583a6de6",
    "page_outputs":  [
                         "visual-asset.svg"
                     ],
    "qa_status":  "pass",
    "generator_version":  "static-synthetic-fixture-1.0",
    "writing_id":  "demo-writing-001",
    "revision":  1
}